{"amount_family":"lognormal_wet_v2","capacity_id":"P2","classification":"a10m5r3-development-only-family-capacity-screen","cold_start_seconds":0.023619313025847077,"export_bytes":1122724,"gates":{"all_98_objects_verified":true,"benchmark_complete":true,"benchmark_dispersion":true,"candidate_fit_only":true,"checkpoint_complete":true,"clean_vmhwm":true,"cold_load":true,"cuda_hidden":true,"export_size":true,"external_peak_rss":true,"family_calibration":true,"finite_scores":true,"fit_validation_gradient_free":true,"generation_order_independent":true,"generation_prefix_exact":true,"generation_support":true,"one_core":true,"one_thread":true,"trainer_exited_before_worker":true,"warm_absolute":true},"gpu_fit_wall_seconds":111.61347704310901,"parameter_count":276927,"peak_rss_bytes":669487104,"phase":"frontier","row_id":"frontier-k1-s271828","runtime_ratio_max":6.087880315465025,"schema_version":2,"training_seed":271828,"valid":true,"validation_primary_nll":2.5541618154162453,"validation_stability":0.9122085855120705,"validation_tail_score":0.20808873176574708,"verdict":"PASS"}
